[
  {
    "id": "0",
    "name": "Derrick Henry",
    "position": "RB",
    "team": "BAL",
    "opponent": "CLE",
    "salary": 8200,
    "ffpg": "17.8",
    "oprk": "3rd",
    "game_info": "CLE @ BAL",
    "last_updated": "2025-09-17T02:58:59.238785"
  },
  {
    "id": "2",
    "name": "Ja'Marr Chase",
    "position": "WR",
    "team": "CIN",
    "opponent": "JAX",
    "salary": 8100,
    "ffpg": "22.1",
    "oprk": "26th",
    "game_info": "JAX @ CIN",
    "last_updated": "2025-09-17T02:58:59.238798"
  },
  {
    "id": "4",
    "name": "Saquon Barkley",
    "position": "RB",
    "team": "PHI",
    "opponent": "KC",
    "salary": 8000,
    "ffpg": "17.9",
    "oprk": "5th",
    "game_info": "PHI @ KC",
    "last_updated": "2025-09-17T02:58:59.238801"
  },
  {
    "id": "6",
    "name": "CeeDee Lamb",
    "position": "WR",
    "team": "DAL",
    "opponent": "NYG",
    "salary": 7800,
    "ffpg": "22.1",
    "oprk": "32nd",
    "game_info": "NYG @ DAL",
    "last_updated": "2025-09-17T02:58:59.238802"
  },
  {
    "id": "8",
    "name": "Puka Nacua",
    "position": "WR",
    "team": "LAR",
    "opponent": "TEN",
    "salary": 7600,
    "ffpg": "26.9",
    "oprk": "28th",
    "game_info": "LAR @ TEN",
    "last_updated": "2025-09-17T02:58:59.238804"
  },
  {
    "id": "10",
    "name": "Christian McCaffrey",
    "position": "RB",
    "team": "SF",
    "opponent": "NO",
    "salary": 7500,
    "ffpg": "23.0",
    "oprk": "23rd",
    "game_info": "SF @ NO",
    "last_updated": "2025-09-17T02:58:59.238805"
  },
  {
    "id": "12",
    "name": "Jahmyr Gibbs",
    "position": "RB",
    "team": "DET",
    "opponent": "CHI",
    "salary": 7400,
    "ffpg": "17.2",
    "oprk": "28th",
    "game_info": "CHI @ DET",
    "last_updated": "2025-09-17T02:58:59.238807"
  },
  {
    "id": "14",
    "name": "Josh Allen",
    "position": "QB",
    "team": "BUF",
    "opponent": "NYJ",
    "salary": 7100,
    "ffpg": "26.8",
    "oprk": "19th",
    "game_info": "BUF @ NYJ",
    "last_updated": "2025-09-17T02:58:59.238808"
  },
  {
    "id": "15",
    "name": "Malik Nabers",
    "position": "WR",
    "team": "NYG",
    "opponent": "DAL",
    "salary": 7100,
    "ffpg": "26.4",
    "oprk": "31st",
    "game_info": "NYG @ DAL",
    "last_updated": "2025-09-17T02:58:59.238809"
  },
  {
    "id": "17",
    "name": "Lamar Jackson",
    "position": "QB",
    "team": "BAL",
    "opponent": "CLE",
    "salary": 7000,
    "ffpg": "27.8",
    "oprk": "15th",
    "game_info": "CLE @ BAL",
    "last_updated": "2025-09-17T02:58:59.238810"
  },
  {
    "id": "18",
    "name": "Amon-Ra St. Brown",
    "position": "WR",
    "team": "DET",
    "opponent": "CHI",
    "salary": 7000,
    "ffpg": "25.4",
    "oprk": "29th",
    "game_info": "CHI @ DET",
    "last_updated": "2025-09-17T02:58:59.238811"
  },
  {
    "id": "20",
    "name": "De'Von Achane",
    "position": "RB",
    "team": "MIA",
    "opponent": "NE",
    "salary": 6900,
    "ffpg": "21.4",
    "oprk": "18th",
    "game_info": "NE @ MIA",
    "last_updated": "2025-09-17T02:58:59.238813"
  },
  {
    "id": "22",
    "name": "Jalen Hurts",
    "position": "QB",
    "team": "PHI",
    "opponent": "KC",
    "salary": 6800,
    "ffpg": "17.9",
    "oprk": "22nd",
    "game_info": "PHI @ KC",
    "last_updated": "2025-09-17T02:58:59.238815"
  },
  {
    "id": "23",
    "name": "Chase Brown",
    "position": "RB",
    "team": "CIN",
    "opponent": "JAX",
    "salary": 6800,
    "ffpg": "10.8",
    "oprk": "8th",
    "game_info": "JAX @ CIN",
    "last_updated": "2025-09-17T02:58:59.238816"
  },
  {
    "id": "25",
    "name": "Jonathan Taylor",
    "position": "RB",
    "team": "IND",
    "opponent": "DEN",
    "salary": 6700,
    "ffpg": "22.7",
    "oprk": "15th",
    "game_info": "DEN @ IND",
    "last_updated": "2025-09-17T02:58:59.238817"
  },
  {
    "id": "27",
    "name": "Brian Thomas Jr.",
    "position": "WR",
    "team": "JAX",
    "opponent": "CIN",
    "salary": 6700,
    "ffpg": "9.0",
    "oprk": "19th",
    "game_info": "JAX @ CIN",
    "last_updated": "2025-09-17T02:58:59.238818"
  },
  {
    "id": "29",
    "name": "Joe Burrow",
    "position": "QB",
    "team": "CIN",
    "opponent": "JAX",
    "salary": 6600,
    "ffpg": "7.9",
    "oprk": "20th",
    "game_info": "JAX @ CIN",
    "last_updated": "2025-09-17T02:58:59.238820"
  },
  {
    "id": "30",
    "name": "James Conner",
    "position": "RB",
    "team": "ARI",
    "opponent": "CAR",
    "salary": 6600,
    "ffpg": "13.3",
    "oprk": "20th",
    "game_info": "CAR @ ARI",
    "last_updated": "2025-09-17T02:58:59.238822"
  },
  {
    "id": "32",
    "name": "A.J. Brown",
    "position": "WR",
    "team": "PHI",
    "opponent": "KC",
    "salary": 6600,
    "ffpg": "4.8",
    "oprk": "22nd",
    "game_info": "PHI @ KC",
    "last_updated": "2025-09-17T02:58:59.238823"
  },
  {
    "id": "34",
    "name": "Garrett Wilson",
    "position": "WR",
    "team": "NYJ",
    "opponent": "BUF",
    "salary": 6500,
    "ffpg": "15.8",
    "oprk": "6th",
    "game_info": "BUF @ NYJ",
    "last_updated": "2025-09-17T02:58:59.238824"
  },
  {
    "id": "36",
    "name": "Kyler Murray",
    "position": "QB",
    "team": "ARI",
    "opponent": "CAR",
    "salary": 6400,
    "ffpg": "16.7",
    "oprk": "2nd",
    "game_info": "CAR @ ARI",
    "last_updated": "2025-09-17T02:58:59.238826"
  },
  {
    "id": "37",
    "name": "James Cook",
    "position": "RB",
    "team": "BUF",
    "opponent": "NYJ",
    "salary": 6400,
    "ffpg": "25.4",
    "oprk": "25th",
    "game_info": "BUF @ NYJ",
    "last_updated": "2025-09-17T02:58:59.238827"
  },
  {
    "id": "39",
    "name": "Tyreek Hill",
    "position": "WR",
    "team": "MIA",
    "opponent": "NE",
    "salary": 6400,
    "ffpg": "14.0",
    "oprk": "30th",
    "game_info": "NE @ MIA",
    "last_updated": "2025-09-17T02:58:59.238828"
  },
  {
    "id": "41",
    "name": "Brock Purdy",
    "position": "QB",
    "team": "SF",
    "opponent": "NO",
    "salary": 6300,
    "ffpg": "18.8",
    "oprk": "21st",
    "game_info": "SF @ NO",
    "last_updated": "2025-09-17T02:58:59.238830"
  },
  {
    "id": "42",
    "name": "Kyren Williams",
    "position": "RB",
    "team": "LAR",
    "opponent": "TEN",
    "salary": 6300,
    "ffpg": "12.0",
    "oprk": "21st",
    "game_info": "LAR @ TEN",
    "last_updated": "2025-09-17T02:58:59.238831"
  },
  {
    "id": "44",
    "name": "Courtland Sutton",
    "position": "WR",
    "team": "DEN",
    "opponent": "IND",
    "salary": 6300,
    "ffpg": "9.9",
    "oprk": "15th",
    "game_info": "DEN @ IND",
    "last_updated": "2025-09-17T02:58:59.238832"
  },
  {
    "id": "46",
    "name": "Patrick Mahomes",
    "position": "QB",
    "team": "KC",
    "opponent": "PHI",
    "salary": 6200,
    "ffpg": "24.6",
    "oprk": "9th",
    "game_info": "PHI @ KC",
    "last_updated": "2025-09-17T02:58:59.238834"
  },
  {
    "id": "47",
    "name": "Breece Hall",
    "position": "RB",
    "team": "NYJ",
    "opponent": "BUF",
    "salary": 6200,
    "ffpg": "12.7",
    "oprk": "17th",
    "game_info": "BUF @ NYJ",
    "last_updated": "2025-09-17T02:58:59.238835"
  },
  {
    "id": "49",
    "name": "Zay Flowers",
    "position": "WR",
    "team": "BAL",
    "opponent": "CLE",
    "salary": 6200,
    "ffpg": "23.0",
    "oprk": "17th",
    "game_info": "CLE @ BAL",
    "last_updated": "2025-09-17T02:58:59.238836"
  },
  {
    "id": "51",
    "name": "Bo Nix",
    "position": "QB",
    "team": "DEN",
    "opponent": "IND",
    "salary": 6100,
    "ffpg": "15.5",
    "oprk": "10th",
    "game_info": "DEN @ IND",
    "last_updated": "2025-09-17T02:58:59.238837"
  },
  {
    "id": "52",
    "name": "Alvin Kamara",
    "position": "RB",
    "team": "NO",
    "opponent": "SF",
    "salary": 6100,
    "ffpg": "15.4",
    "oprk": "12th",
    "game_info": "SF @ NO",
    "last_updated": "2025-09-17T02:58:59.238838"
  },
  {
    "id": "54",
    "name": "Tee Higgins",
    "position": "WR",
    "team": "CIN",
    "opponent": "JAX",
    "salary": 6100,
    "ffpg": "10.5",
    "oprk": "26th",
    "game_info": "JAX @ CIN",
    "last_updated": "2025-09-17T02:58:59.238839"
  },
  {
    "id": "56",
    "name": "Jared Goff",
    "position": "QB",
    "team": "DET",
    "opponent": "CHI",
    "salary": 6000,
    "ffpg": "24.4",
    "oprk": "32nd",
    "game_info": "CHI @ DET",
    "last_updated": "2025-09-17T02:58:59.238841"
  },
  {
    "id": "57",
    "name": "Chuba Hubbard",
    "position": "RB",
    "team": "CAR",
    "opponent": "ARI",
    "salary": 6000,
    "ffpg": "18.3",
    "oprk": "14th",
    "game_info": "CAR @ ARI",
    "last_updated": "2025-09-17T02:58:59.238842"
  },
  {
    "id": "59",
    "name": "Jaxon Smith-Njigba",
    "position": "WR",
    "team": "SEA",
    "opponent": "PIT",
    "salary": 6000,
    "ffpg": "22.4",
    "oprk": "21st",
    "game_info": "SEA @ PIT",
    "last_updated": "2025-09-17T02:58:59.238843"
  },
  {
    "id": "61",
    "name": "Trey McBride",
    "position": "TE",
    "team": "ARI",
    "opponent": "CAR",
    "salary": 6000,
    "ffpg": "13.0",
    "oprk": "29th",
    "game_info": "CAR @ ARI",
    "last_updated": "2025-09-17T02:58:59.238844"
  },
  {
    "id": "63",
    "name": "Dak Prescott",
    "position": "QB",
    "team": "DAL",
    "opponent": "NYG",
    "salary": 5900,
    "ffpg": "17.0",
    "oprk": "25th",
    "game_info": "NYG @ DAL",
    "last_updated": "2025-09-17T02:58:59.238845"
  },
  {
    "id": "64",
    "name": "Tony Pollard",
    "position": "RB",
    "team": "TEN",
    "opponent": "LAR",
    "salary": 5900,
    "ffpg": "9.1",
    "oprk": "2nd",
    "game_info": "LAR @ TEN",
    "last_updated": "2025-09-17T02:58:59.238847"
  },
  {
    "id": "66",
    "name": "DK Metcalf",
    "position": "WR",
    "team": "PIT",
    "opponent": "SEA",
    "salary": 5900,
    "ffpg": "11.7",
    "oprk": "1st",
    "game_info": "SEA @ PIT",
    "last_updated": "2025-09-17T02:58:59.238848"
  },
  {
    "id": "68",